cluster,key word,response,processed response
5,enabl,Because it enables me to study in my own pace which makes it easier for me to really engage with the material,enabl studi pace make easier realli engag materi
5,choos,Because you can choose the time you are able to work on the lectures and at which pace ,choos time abl work lectur pace
5,pace,I can learn at my own pace,learn pace
5,thing,Because I can learn things at my own time and at my own pace,learn thing time pace
5,materi,Because you can go at your own pace through the material,go pace materi
5,abil,The ability to rewind and take in a lecture at my own pace. ,abil rewind take lectur pace
5,materi,Can go through the material at my pace,go materi pace
5,whatev,Can take them at my own pace and at whatever time suits me best. ,take pace whatev time suit best
5,easiest,Easiest to follow as you can work through it at your own pace,easiest follow work pace
5,pace,Can work at own pace,work pace
5,keep,Because it's engaging but I can keep it at my own pace,engag keep pace
5,relisten,It allows me to organize my work on my own pace and go back to re-listen if needed,allow organ work pace go back relisten need
5,pace,I can work at my own pace,work pace
5,pace,I can watch and learn at my own pace,watch learn pace
5,pace,Being able to pause and work at your own pace,abl paus work pace
5,follow,I can follow the lecture at my own pace,follow lectur pace
5,pace,I can watch it in my own pace. ,watch pace
5,thing,Allows me to do things at my own pace ,allow thing pace
5,mean,This means I can go through the material in my own pace. ,mean go materi pace
5,hard,Because it allows me to learn at my own pace and I find online lectures very hard to follow ,allow learn pace find onlin lectur hard follow
5,suit,I can watch at my own pace and at the time it suits me,watch pace time suit
5,pace,I can watch it at my own pace,watch pace
5,freedom,Gives me the freedom I need to work with the content at my own pace.,give freedom need work content pace
5,follow,"With recorded lectures, I am able to follow them at my own pace and watch them when I have time.",record lectur abl follow pace watch time
5,watchlearn,Allows me to watch/learn at my own pace,allow watchlearn pace
5,pace,Can do it at my own pace!,pace
5,remov,Because it allows me to work in my own pace with the material and it removes the pressure of having to go to lectures ,allow work pace materi remov pressur go lectur
5,modul,Allows you to have your own pace at learning the module,allow pace learn modul
5,pace,Because I can learn at my own pace ,learn pace
5,studi,I can study in my own pace,studi pace
5,go,Able to go at my own pace,abl go pace
5,enabl,Having pre-recorded lectures enables me to work at my own pace and plan out my own day. ,prerecord lectur enabl work pace plan day
5,slower,"It allows me to go at my own pace. Faster or slower, whatever I need",allow go pace faster slower whatev need
5,pace,I can learn at my own time and pace,learn time pace
5,love,"It takes more time, but i can work at my own pace, which I love!",take time work pace love
5,review,It allows you to go back and review the material and work at your own pace ,allow go back review materi work pace
5,easi,Easy to watch at my own pace.,easi watch pace
5,suit,I am able to go through the content at a pace that suits me best,abl go content pace suit best
5,done,Can be done at your own pace ,done pace
5,refer,Easy to use at my own pace and refer to whenever.,easi use pace refer whenev
5,go,Can go on my own pace ,go pace
5,faster,So I can watch it faster and learn at the pace I like,watch faster learn pace like
5,go,Can go at my own pace ,go pace
5,note,So that i can watch it and take notes at my own pace,watch take note pace
5,absorb,I can take in and absorb information at my own pace,take absorb inform pace
5,look,You can look at it when you like and go at your own pace.,look like go pace
5,go,Can go at your own pace ,go pace
5,pace,I can work at my own pace ,work pace
5,timet,"Can go at my own pace, speed up skip replay.  Work at my own timetable. ",go pace speed skip replay work timet
5,suitabl,"I can complete the work at my own pace, and at a time that is suitable for me",complet work pace time suitabl
5,read,I work better at my own pace and being able to read material helps me. ,work better pace abl read materi help
5,cours,Easier to go through the course at your own pace,easier go cours pace
5,timescal,I can work at my own pace and timescale. It works around my employment and my free time. ,work pace timescal work around employ free time
5,disengag,i find zoom calls very disengaging so i like to be able to go at my own pace with prerecorded content,find zoom call disengag like abl go pace prerecord content
5,note,I can watch in my own time and make notes at my own pace ,watch time make note pace
5,chat,"I can go through at my own pace, and can email/ chat over zoom if I have further questions.",go pace email chat zoom question
5,materi,I am able to go through the material at my own pace.,abl go materi pace
5,want,Can watch at my own pace when I want,watch pace want
5,pace,Can work through them at your own pace,work pace
5,pace,i can pause the lectures and learn at my own pace ,paus lectur learn pace
5,pace,Can do it in your own time at your own pace,time pace
5,complet,I can complete the work at my own pace,complet work pace
5,pace,Can do it at your own pace,pace
5,audio,Allows me to watch the lectures at my own pace and the audio and visuals help me to understand the topics. ,allow watch lectur pace audio visual help understand topic
5,enjoy,I enjoy being able to learn at my own pace & have the ability to rewatch material,enjoy abl learn pace abil rewatch materi
5,pace,Can learn at my own pace,learn pace
5,lesson,You can take the lesson at your own pace,take lesson pace
5,complet,You can complete work at your own pace ,complet work pace
5,work,Can work at your own pace. Can pause if you don’t understand something. Can work whenever you like without.,work pace paus don’t understand someth work whenev like without
5,pace,I can work at my own pace ,work pace
5,overwhelm,It means I can work through them in my own time and at a pace where it doesn't overwhelm me.,mean work time pace doesnt overwhelm
5,reflect,Gives me more time to work at my own pace and reflect on the content,give time work pace reflect content
5,pace,I can work through the lectures at my own pace. ,work lectur pace
5,pace,I can watch and learn at my own pace,watch learn pace
5,learner,"I find it easier in this time to work at my own pace, and I am more of a visual learner",find easier time work pace visual learner
5,pace,I can watch at my own pace,watch pace
5,timen,"Can go at my own pace, at a convenient time\n",go pace conveni timen
5,rewatch,Can rewatch and pause to go at my own pace,rewatch paus go pace
5,pace,Can do it at my own pace. ,pace
5,rewind,Can rewind/ speed up and study at own pace ,rewind speed studi pace
5,pace,Can watch at your own pace. ,watch pace
5,therefor,As I can pause the lecture and therefore learn the content at my own pace.,paus lectur therefor learn content pace
5,materi,Can work through material at your own pace,work materi pace
5,go,easier to go over in my own time and work at my own pace,easier go time work pace
5,go,Allows me to go at my own pace,allow go pace
5,pace,I can do the work at my own pace,work pace
5,go,I can go at my own pace ,go pace
5,engin,"As an engineering student, it makes more sense to go through and understand the content at my own pace while doing questions",engin student make sens go understand content pace question
5,particip,You can participate in the learning at your own pace ,particip learn pace
5,tech,Allows me to go at my own pace without tech issues ,allow go pace without tech issu
5,use,I can use it at my own pace.,use pace
5,studi,"You can watch the lecture in your own time, pause it and make it easier to study at your own pace! ",watch lectur time paus make easier studi pace
5,pace,Do it at my own pace,pace
5,go,I am able to go through it at my own pace,abl go pace
5,go,You can go at your own pace,go pace
5,choos,I can watch them at my own pace and when I choose to,watch pace choos
5,want,You can do it at your own pace and when you want to do it,pace want
5,pace,You can work through at your own pace,work pace
5,pace,Can learn at own pace,learn pace
5,pace,I can do work at my own pace ,work pace
5,pace,Work through at own pace and then ask questions ,work pace ask question
5,revis,Ability to take things at own pace and revise from material ,abil take thing pace revis materi
5,pace,I can do it at my own pace ,pace
5,pace,Can do at own pace,pace
5,prefer,Can do this at my own preferred time and pace.,prefer time pace
5,thing,It allows me to learn things at my own pace and only have to go over the things that I specifically don’t understand,allow learn thing pace go thing specif don’t understand
5,rush,Because I can work through it at my own pace and not feel rushed,work pace feel rush
5,pace,It allows me to do work at my own pace ,allow work pace
5,afterward,Because it allows you to work at your own pace and you can have a discussion with your peers about it afterwards without any pressure from specific meetings,allow work pace discuss peer afterward without pressur specif meet
5,materi,I can work through the material at my own pace,work materi pace
5,yet,You can go at your own pace yet have all the information ready to learn.,go pace yet inform readi learn
5,review,Can review at own pace,review pace
5,pace,learning at my own pace,learn pace
5,pace,"I can do the work in my own time, at my own pace",work time pace
5,content,It allows me to work through the content at my own pace ,allow work content pace
5,go,Can go at my own pace,go pace
5,content,I can go over the content at my own pace,go content pace
5,pace,Can do at your own pace + time,pace time
5,set,Set my own pace,set pace
5,watchrewatch,Can watch/rewatch at my own pace. ,watchrewatch pace
5,look,Because I can look through at my own pace.,look pace
5,pace,I can watch at my own pace.,watch pace
5,voic,Can watch at my own time and pace but still hearing a voice ,watch time pace still hear voic
5,ahead,I can do it on my own time and at my own pace. I prefer to work ahead whenever possible. ,time pace prefer work ahead whenev possibl
5,move,It allows me to move at my own pace.,allow move pace
5,independ,I like to work independently/ at my own pace,like work independ pace
5,otherwis,I’m able to work at my own pace and focus on details otherwise skipped over due to the lack of time.,i’m abl work pace focu detail otherwis skip due lack time
5,pace,I can watch the same lecture at my own pace.,watch lectur pace
6,interact,because it is interactive ,interact
6,interact,Interaction ,interact
6,interact,Interactive ,interact
6,allow,it allows interaction,allow interact
6,interact,Interactive ,interact
6,interact,interactive,interact
6,interact,It is more interactive,interact
6,learn,Interactive learning ,interact learn
6,interact,More interactive ,interact
6,interact,More interactive ,interact
6,interact,More interactive ,interact
6,interact,More interaction,interact
6,interact,More interaction ,interact
6,allow,Allows interaction ,allow interact
6,interact,Interaction,interact
6,interact,The interaction ,interact
6,interact,There is more interaction ,interact
6,interact,Interaction,interact
6,interact,interaction,interact
6,live,Live interactions,live interact
6,interact,more interactions,interact
6,interact,Interactive,interact
6,professor,Interaction with professors,interact professor
6,interact,Interactive ,interact
6,interact,It is more interactive,interact
6,live,We can interact live ,interact live
6,feel,It feels more interactive ,feel interact
6,interact,More interactive ,interact
6,it,It’s more interactive ,it’ interact
6,interact,It is the most interactive of all,interact
6,interact,Interaction,interact
6,interact,More interactive,interact
6,learn,Interactive learning ,interact learn
6,interact,Interaction with the lecturers,interact lectur
6,interact,More interactive ,interact
6,professor,Because I can interact with the professor ,interact professor
6,interact,More interaction,interact
6,it,Because it’s the most interactive.,it’ interact
6,interact,Because of the interaction,interact
6,interact,More interactive ,interact
6,allow,This allows for interaction,allow interact
6,it,Because it’s interactive ,it’ interact
6,interact,Because it is more interactive ,interact
6,interact,More interaction,interact
6,allow,It allows for more interaction,allow interact
6,professor,Because of the interaction with the professors,interact professor
6,interact,More interaction ,interact
6,interact,Interactivity,interact
6,professor,Interaction with professors,interact professor
6,interact,Interactive \n,interact n
6,interact,More interactive ,interact
6,interact,Interaction,interact
6,professor, have more interaction with professors,interact professor
6,interact,More interaction,interact
6,discuss,More interaction and discussion ,interact discuss
6,it,It’s more interactive,it’ interact
6,interact,More interactive ,interact
6,interact,It is more interactive ,interact
6,it,It’s interactive ,it’ interact
6,interact,More interactive ,interact
6,interact,More interactive,interact
6,interact,Can interact with the lecturer,interact lectur
6,interact,most interactive,interact
6,interact,more interaction,interact
6,interact,More interactive ,interact
6,interact,More interactive,interact
6,interact,It's interactive ,interact
6,interact,More interactive ,interact
6,interact,interactive,interact
6,interact,More interactive,interact
6,interact,it is interactive,interact
6,interact,More interactive,interact
6,it,It’s most interactive ,it’ interact
6,interact,Most interactive ,interact
6,interact,Interactive ,interact
6,interact,Interactive,interact
6,interact,Interactive ,interact
6,interact,Interactive,interact
6,interact,Most interactive ,interact
6,interact,More interactive ,interact
6,interact,More interactive ,interact
6,interact,More interaction ,interact
6,interact,More interactive,interact
6,interact,It is more interactive ,interact
6,it,Because it’s more interactive ,it’ interact
6,interact,More interactive ,interact
6,it,It’s more interactive ,it’ interact
6,interact,More interactive ,interact
6,interact,More interactive ,interact
6,interact,More interactive ,interact
6,interact,More interactive,interact
6,interact,More interactive ,interact
6,it,It’s more interactive. ,it’ interact
6,interact,More interactive ,interact
6,interact,More interactive ,interact
6,interact,Interactivity ,interact
6,interact,Interactive,interact
6,discuss,More interaction and discussion,interact discuss
6,allow,Because it allows interaction ,allow interact
6,interact,More interaction ,interact
6,interact,Interactive ,interact
6,interact,More interactive! ,interact
6,interact,More interaction,interact
6,feel,It feels more interactive,feel interact
6,interact,More interactive ,interact
6,interact,More interactive,interact
6,interact,More interactive ,interact
6,interact,More interactive,interact
6,interact,interaction ,interact
6,interact,Interactive ,interact
6,interact,More interactive ,interact
6,it,It’s more interactive ,it’ interact
6,interact,Most interactive ,interact
6,interact,So I can interact with the lecturer,interact lectur
6,interact,more interactive ,interact
6,get,You get the most interaction ,get interact
6,interact,More interactive ,interact
6,interact,More interactive ,interact
6,interact,Interactive ,interact
6,interact,More interactive ,interact
6,interact,More interactive,interact
6,interact,More interaction ,interact
6,interact,Can be more interactive ,interact
6,interact,Interactive ,interact
6,interact,More interactive,interact
6,interact,More interactive ,interact
6,interact,Interactivity,interact
6,interact,More interactive,interact
7,manag,Because I manage my time,manag time
7,organ,Because you can organize yourself as you like and watch it at any time in the day ,organ like watch time day
7,schedule,"Because I can interact with my professors and it also gives a “schedule”, or a specific time to do uni work an focus on that.",interact professor also give “schedule” specif time uni work focu
7,high,Because it allows to maintain a high quality content while learning times are managed by the students,allow maintain high qualiti content learn time manag student
7,doubl,I find zoom classes boring so watch them on double speed for time efficiency ,find zoom class bore watch doubl speed time effici
7,worlds,I can pause at any time necessary (recorded lectures) but I have the advantage of “Live Question Time” in which questions about the lecture (which I have now thoroughly watched) can be asked. Essentially I have “the best of both worlds”. ,paus time necessari record lectur advantag “live question time” question lectur thoroughli watch ask essenti “the best worlds”
7,rewindrewatch,I prefer being able to rewind/rewatch the lessons at a later time if I didn’t comprehend them well enough the first time.,prefer abl rewindrewatch lesson later time didn’t comprehend well enough first time
7,email,can do in my own time and email for help if needed,time email help need
7,full,Easier for my schedule as I work full time,easier schedul work full time
7,larg,"Allows me to work in my own time, effectively communicates large amounts of content ",allow work time effect commun larg amount content
7,faster,I am able to work at a faster pace than I would in real time classes and be more efficient with my time,abl work faster pace would real time class effici time
7,block,Makes it easier for me to block out my time and keeps it flexible ,make easier block time keep flexibl
7,frame,"Recorded lectures allow me to study the content my own time and at my own pace. However, if I don’t complete the lectures in a certain time frame then I will more work to do.",record lectur allow studi content time pace howev don’t complet lectur certain time frame work
7,permit,Able to stop and do when time permits ,abl stop time permit
7,system,"More time to look through the information, more systemized",time look inform system
7,put,I'm able to work through the material in my own time any put the focus where I need it to be ,im abl work materi time put focu need
7,explain,Because the professor is explaining it but I can access it at any time,professor explain access time
7,faster,I learn faster on my own. Classes via zoom take too much of my time,learn faster class via zoom take much time
7,bound,I can schedule my day better. I can choose when I will watch my lectures. I’m not bound by time.,schedul day better choos watch lectur i’m bound time
7,focus,"When it's live, it forces me to be up and focused at a certain time: it provides structure",live forc focus certain time provid structur
7,normali,"When classes are live, it's easier to mange your time and you have more a feeling of engagment. My live classes start normaly at 8:30 so I have to wake up at time. When they are recorded I tend to sleep in and lose a lot of time. ",class live easier mang time feel engag live class start normali 830 wake time record tend sleep lose lot time
7,right,"Forces you to participate at the ""right"" time.",forc particip right time
7,set,I can watch it when I want and not at a set time. ,watch want set time
7,pay,Because it motivates me to pay attention and it's nice to know that everyone is watching at the same time.,motiv pay attent nice know everyon watch time
7,lose,"You lose less time, once a lecture is given, it’a done  + structure",lose less time lectur given it’a done structur
7,classform,You get the information still in classform but you can watch it later when you have time on your pace,get inform still classform watch later time pace
7,studi,I can study on my own time,studi time
7,process,Chance to process the information in my own time.,chanc process inform time
7,easier,Easier to watch on your own time ,easier watch time
7,slide,Instructors give more explanation than on their slides and I can watch the video at a convenient time.,instructor give explan slide watch video conveni time
7,watchlisten,It's easier to understand and we can watch/listen to the material several times.,easier understand watchlisten materi sever time
7,term,it gives you the space to go in you own terms and time ,give space go term time
7,studentsmyself,That would be much easier for the international students(myself being one) cause of the time difference and most importantly the internet acess is very poor at times.,would much easier intern studentsmyself one caus time differ importantli internet acess poor time
7,depend,"I can manage my productive time on my own, without depending on the set time of an online lecture ",manag product time without depend set time onlin lectur
7,plan,I can plan my own time.,plan time
7,tailor,It gives me more freedom in learning and tailoring my own study timings and creating a flexible system that works for me ,give freedom learn tailor studi time creat flexibl system work
7,energi,It’s better to have a specific time assigned to watch a certain lecture rather than it being recorded and uploaded because it requires more energy to actually sit down and watch those later ,it’ better specif time assign watch certain lectur rather record upload requir energi actual sit watch later
7,singl,Because I can spend more time in reading every single topic.,spend time read everi singl topic
7,chill,Because I don't need to do much. I can just chill and listen. (And draw at the same time.),dont need much chill listen draw time
7,prepar,I like knowing other people are joining at the same time (a sense of community) and it helps me keep accountable on the work because I have to prepare for classes at a certain day and time instead of whenever ,like know peopl join time sens commun help keep account work prepar class certain day time instead whenev
7,watch,I can watch it when I have the time,watch time
7,easiest,Because like that it’s easiest to manage your time. ,like it’ easiest manag time
7,focu,easier to focus than reading but accessible at all time + can pause it,easier focu read access time paus
7,restrict,"Doesn't restrict me to certain times, which contributes to independence in deciding the best time to do work ",doesnt restrict certain time contribut independ decid best time work
7,week,You can plan your time more flexible but I think it’s best when there is a zoom lecture each week for questions. ,plan time flexibl think it’ best zoom lectur week question
7,save,Flexibility and time saving ,flexibl time save
7,manag,"More flexible time management, it works better ",flexibl time manag work better
7,connect,Real time connection to the person who is teaching the class,real time connect person teach class
7,choos,"I can choose the time, when I can concentrate the best",choos time concentr best
7,free,Free time managment ,free time manag
7,flow,I can work in my own flow and at my preferred time. ,work flow prefer time
7,enough,Because the internet connection isn‘t always good enough for live classes and I like watching it on the time I have time,internet connect isn‘t alway good enough live class like watch time time
7,plan,I can plan my time better,plan time better
7,faster,I can plan my time better and watch the videos in a faster speed,plan time better watch video faster speed
7,independ,Because I can replay the lectures and work time independent,replay lectur work time independ
7,fulli,You can watch the lectures in your own time and fully understand everything.,watch lectur time fulli understand everyth
7,certain,"Because I can do it when I have the time to do it or want to do it, I can listen to the lectures faster and it just saves me a lot of time. I am also more motivated when I decide that i want to do something and not when I have to do it on a certain day at a certain point of time.",time want listen lectur faster save lot time also motiv decid want someth certain day certain point time
7,highli,"It gives me the time I need and I can always watch it back multiple times. Live classes are helpful to keep a schedule, but they also depend highly on time and technical stuff like wifi connection, which is not the best",give time need alway watch back multipl time live class help keep schedul also depend highli time technic stuff like wifi connect best
7,playback,You can watch them in your own time and increase the playback speed,watch time increas playback speed
7,al,"Because you have a set time for the course, which helps to bring structure to my life at the moment. I also like the possibility to interact with instructors as well als fellow students in real time.",set time cours help bring structur life moment also like possibl interact instructor well al fellow student real time
7,procastin,"It happens at a specific time, which makes it easier not to procastinate",happen specif time make easier procastin
7,free,Because I am free in my time management and can watch the lecture when I have time for it,free time manag watch lectur time
7,access,Access all the time,access time
7,mani,Because I can rewatch the recordings as many times as I want.,rewatch record mani time want
7,rhythm,Own time and rhythm ,time rhythm
7,support,I still have some sort of support from my lecturer but can do the lecture in my own time,still sort support lectur lectur time
7,happen,"Because everything is happening real time and you can participate, almost as if you were in class.",everyth happen real time particip almost class
7,doesnt,"Time efficient, comfortable and doesn't depend on internet connection speed. ",time effici comfort doesnt depend internet connect speed
7,arent,Usually the timings aren't good,usual time arent good
