cluster,key word,response,processed response
3,materi,"I feel heavily engaged with the lecture via live classes. Other methods of online teaching that are currently available such as recorded lectures and uploaded material put a substantial amount of pressure on students to understand lecture material with minimal elaboration. As a result, emailing lectures about the material then becomes time consuming. ",feel heavili engag lectur via live class method onlin teach current avail record lectur upload materi put substanti amount pressur student understand lectur materi minim elabor result email lectur materi becom time consum
3,lecturestutori,This is the most interactive mode of teaching and most closely resembles the in-person lectures/tutorials I had before classes were shifted online. ,interact mode teach close resembl inperson lecturestutori class shift onlin
3,alongsid,Motivates me to do it at that time (instead of catching it up later) as it’s live as there can be a discussion alongside it,motiv time instead catch later it’ live discuss alongsid
3,date,It’s easier to keep up to date if they’re live- not sure why but it works. And it also adds a bit more structure to my day which I like,it’ easier keep date they’r live sure work also add bit structur day like
3,skill,I would prefer the flexibility to teach myself as and when. Plus online lectures means that if you have a lecturer who isn’t very skilled it leads to several hours of wasted time trying to listen and learn from them,would prefer flexibl teach plu onlin lectur mean lectur isn’t skill lead sever hour wast time tri listen learn
3,feedbackinst,You’re getting live feedback/instant responses,you’r get live feedbackinst respons
3,would,This way would be like as if I would be attending the lecture at uni ,way would like would attend lectur uni
3,explor,It’s all I have know n would like explore,it’ know n would like explor
3,otherwis,Forces me to engage. Anything otherwise and I would struggle to structure my work. ,forc engag anyth otherwis would struggl structur work
3,authent,"most ""authentic"" (chats with people etc)",authent chat peopl etc
3,heard,To able to get other people’s feedback and easier to be heard the knowledge of module and it is explained better,abl get people’ feedback easier heard knowledg modul explain better
3,posit,Allows better engagement and creates a more positive working atmosphere making everyone still feel connected and allows more time with tutors.,allow better engag creat posit work atmospher make everyon still feel connect allow time tutor
3,asid,It makes me accountable and ensures I put aside enough time to really understand the content,make account ensur put asid enough time realli understand content
3,pausedo,Can pause/do when it suits you,pausedo suit
3,induc,"It’s easy to access, can pause and replay, less anxiety inducing than zoom and you can still email lecturers with any questions.",it’ easi access paus replay less anxieti induc zoom still email lectur question
3,smallgroup,"Small-group teaching where you can discuss your thoughts and bounce ideas off your peers is always the most constructive, in my opinion! Also, I study foreign languages so it’s imperative to often be speaking and hearing them! ",smallgroup teach discuss thought bounc idea peer alway construct opinion also studi foreign languag it’ imper often speak hear
3,tricki,"You can get instant feedback on work, have communication to give you a sense of normality, and also as a music student it’s pretty tricky to do without it!",get instant feedback work commun give sens normal also music student it’ pretti tricki without
3,opporun,"I like to work at my own pace, and then have the opporunity to ask questions in a seminar later, rather than rushing through notes in a live lecture ",like work pace opporun ask question seminar later rather rush note live lectur
3,inclass,"Most similar to inclass, allows discussions to happen in front of everyone. ",similar inclass allow discuss happen front everyon
3,laptop,I like to work through materials at my own pace. With ADHD it is hard to focus on a laptop screen for an hour especially watching live lectures ,like work materi pace adhd hard focu laptop screen hour especi watch live lectur
3,version,Live nature of it most resembles the normal version ,live natur resembl normal version
3,zone,It's too easy to zone out in online classes so it's easier to just teach myself.,easi zone onlin class easier teach
3,structur,Most similar to a normal class structure,similar normal class structur
3,speed,Easier to speed up and listen to,easier speed listen
3,poor,Zoom has poor connection,zoom poor connect
3,son,"More convinient and means I’m not waking up at 9am to see some 40 year old crusty man with obvious home issues due to the constant screaming in his house and His sons blatant disregard for his Work. It’s official, kids are dicks and chemists are betas 🥺",convini mean i’m wake 9am see 40 year old crusti man obviou home issu due constant scream hous son blatant disregard work it’ offici kid dick chemist beta 🥺
3,today,We have captured lectures today but I find the relationship with my lecturer here more distant. When I’m zoom  with my other course-mates and with small talk before with questions after there feels to be a convergence of the group.,captur lectur today find relationship lectur distant i’m zoom coursem small talk question feel converg group
3,travel,"Easier time wise and travel , I also love independently learning ",easier time wise travel also love independ learn
3,part,"For my language part of the course I prefer Zoom classes, as it can be more interactive. It is the same for seminars. However, I don’t mind recorded lectures for the business part of my degree.",languag part cours prefer zoom class interact seminar howev don’t mind record lectur busi part degre
3,call,"There is something very intimidating about video calls, you also have to deal with privacy issues with calls and you have to inconvenience your family. A forum would be much easier",someth intimid video call also deal privaci issu call inconveni famili forum would much easier
3,readi,It just makes it easier. The work is there ready to go and if you have questions you can google meet if you need to ,make easier work readi go question googl meet need
3,class,I enjoy being able to watch at my pace and rewatch sections which can't be done in live classes. Due to a large class number it is hard to ask questions in the the live classes,enjoy abl watch pace rewatch section cant done live class due larg class number hard ask question live class
3,vagu,I’m at BOVTS doing an actor training and following this type of class then recording myself and sending it back to my tutors allows them to be as specific as they are in the room. When trying to correct 14 students over zoom it gets very vague.,i’m bovt actor train follow type class record send back tutor allow specif room tri correct 14 student zoom get vagu
3,itar,"It's useful to be able to ask questions, but this is only good if it's also recorded!! Incase you miss it/are in a different time zone etc",use abl ask question good also record incas miss itar differ time zone etc
3,usual,It is the closest to how teaching would usually be,closest teach would usual
3,repres,From all the options it is the one that represents more closely the university experience,option one repres close univers experi
3,loneli,increases engagement and helps with loneliness . Also replicated my university experience easily ,increas engag help loneli also replic univers experi easili
3,comment,Can interact live. If you don’t understand something you can post a comment and the tutor will reply there and then rather than having to wait for a response. ,interact live don’t understand someth post comment tutor repli rather wait respons
3,earli,"It’s great if the lectures are live because it motivates you to get up if it’s an early one, also if I have any questions I don’t need to email my lecturer I can just ask it in the chat. ",it’ great lectur live motiv get it’ earli one also question don’t need email lectur ask chat
3,simul,"It best simulates a real classroom. My classes are usually small compared to most, maybe 10 people, as I study languages so having this simulated is really important. It allows real-time questions and for us to practice key skills (ie spoken language) in a way no other format would",best simul real classroom class usual small compar mayb 10 peopl studi languag simul realli import allow realtim question us practic key skill ie spoken languag way format would
3,realli,Video calls really slow any discussions down. Natural discussions don’t really occur in the way they should ,video call realli slow discuss natur discuss don’t realli occur way
3,mixtur,I actually like a mixture of zoom meetings with materials i can look at,actual like mixtur zoom meet materi look
3,smaller,"More discussion allowed, smaller class sizes",discuss allow smaller class size
3,cambridg,Still get to engage with supervisors in small group settings- the most important way if learning at Cambridge,still get engag supervisor small group set import way learn cambridg
3,spoke,"The live classes were mainly 'check in' sessions with group work but nobody spoke in them or had their cameras on so it was really awkward and a waste of time. However with recorded lectures, I could listen to what I needed to, write notes and then email lecturers if I had any questions.",live class mainli check session group work nobodi spoke camera realli awkward wast time howev record lectur could listen need write note email lectur question
3,split,Because you are able to ask any questions during the class. they split us into study rooms so we can talk with our course mates about the topic we are learning about which helps with understanding it. ,abl ask question class split us studi room talk cours mate topic learn help understand
3,express,Freedom to express and listen to opinions,freedom express listen opinion
3,dialogu,Prefer having a two way dialogue,prefer two way dialogu
3,cope,"Not only are you able to get some sort of face-to-face teaching, but you also have a chance to see how people are coping",abl get sort facetofac teach also chanc see peopl cope
3,mate,It seems the most ‘Normal’ as you can see the lecturer and other course mates ,seem ‘normal’ see lectur cours mate
3,accident,It is less stressful because you can go at your own pace and not worry about making noise or your camera accidentally being on during a live lecture ,less stress go pace worri make nois camera accident live lectur
3,flexibl,Flexibility ,flexibl
3,minut,"Because you have to get prepared for the class and contribute in real time. In case of, recorded lectures on online material you don’t do it or do it last minute, usually ",get prepar class contribut real time case record lectur onlin materi don’t last minut usual
3,wider,I think a wider range of content can be given and you can digest it better ,think wider rang content given digest better
3,procrastin,Recorded lectures makes me procrastinate,record lectur make procrastin
3,area,We can still talk and discuss a topic or area.,still talk discuss topic area
3,particip,Class participation,class particip
3,experi,Because i get the same experience as I would in my uni classes in person ,get experi would uni class person
3,main,Because 1 to 1 tutorials are the main teaching method on my course (product design) and with live chats I can get a lot more info out of my tutors ,1 1 tutori main teach method cours product design live chat get lot info tutor
3,wasn,It allows me to still get the input from the lecture if I wasn’t able to attend the live video (which has often been the case!),allow still get input lectur wasn’t abl attend live video often case
3,forumschat,Because I probably wouldn’t watch recorded lectures or engage with forums/chats,probabl wouldn’t watch record lectur engag forumschat
3,regard,"I learn best from reading and writing and because I have time to think and I express myself better through written word, however I understand and value the skill of speaking and presenting ideas in real time, so in-person classes are important in that regard.",learn best read write time think express better written word howev understand valu skill speak present idea real time inperson class import regard
3,stay,Easier to stay focus ,easier stay focu
3,bombard,They can explain things on the spot. We dont have to then bombard their email with questions if they recorded a lecture in advance.,explain thing spot dont bombard email question record lectur advanc
3,bit,"It feels a bit more close to not online lessons, being able to see the teachers and classmates helps a bit. ",feel bit close onlin lesson abl see teacher classmat help bit
3,group,You get live feedback on work and can easily ask all questions and don’t have to wait for a response. Also feels the most natural to what it was like before. I mainly had group tutorials before so we had the same groups in the Zooms,get live feedback work easili ask question don’t wait respons also feel natur like mainli group tutori group zoom
3,stick,"I can get direct feedback on my work, and I can concentrate much better when I’m being engaged with and can actually discuss topics, whereas I find it difficult to stick through recorded lectures when I could stop at any time. ",get direct feedback work concentr much better i’m engag actual discuss topic wherea find difficult stick record lectur could stop time
3,messi,I can do it in my own time and complete then at my own pace. The live workshops we had were just awkward and kinda messy and I didn’t get much from them. ,time complet pace live workshop awkward kinda messi didn’t get much
3,share,More opportunities to share opinions & group discussion with a tutor,opportun share opinion group discuss tutor
3,pretti,It allows us to have our tutorials and classes pretty much as normal ,allow us tutori class pretti much normal
3,format,It’s the format closest to my usual method of teaching (in person seminars) ,it’ format closest usual method teach person seminar
3,live,Live classes,live class
3,around,I’m an essential worker so being able to fit study around work and work around study is important ,i’m essenti worker abl fit studi around work work around studi import
3,elabor,Because you can see what the lecturer is presenting and how they elaborate on different points,see lectur present elabor differ point
3,new,"I have quite intense anxiety which was made worse by the lockdown, the pressure of having to log on and speak online to other students, most of which I hadn’t met because it was a new module, was nerve-wracking ! I barely like phone calls to people I already know so having to do online seminars with a new teacher and new class really affected my mental health. Like when the teacher asked if we had questions, I felt to nervous and anxious to turn my mic on, so ended up dealing with any issues over email anyway. A lot of what we dealt with in class easily could’ve been done through materials emailed to us and teacher feedback rather than awkwardly waiting for someone to speak in the online classroom. Mostly I’d prefer the emails and forums due to my anxiety but also because I can easily re-access that content if I need it.",quit intens anxieti made wors lockdown pressur log speak onlin student hadn’t met new modul nervewrack bare like phone call peopl alreadi know onlin seminar new teacher new class realli affect mental health like teacher ask question felt nervou anxiou turn mic end deal issu email anyway lot dealt class easili could’v done materi email us teacher feedback rather awkwardli wait someon speak onlin classroom mostli i’d prefer email forum due anxieti also easili reaccess content need
3,covid19,"At home it’s harder to keep to specific times especially with the stress of Covid-19, would have been good to have the lectures recorded.",home it’ harder keep specif time especi stress covid19 would good lectur record
3,24,"Always the opportunity to go back over when it comes to revision and especially given the fact I had 24 hour “take home” exams, whereas you don’t have that with live classes / zoom. Just more helpful in my opinion",alway opportun go back come revis especi given fact 24 hour “take home” exam wherea don’t live class zoom help opinion
3,morn,"I can select when I take the class to suit my brain (I’m not a morning person, but am allocated to morning classes) ",select take class suit brain i’m morn person alloc morn class
3,effect,Just as effective as in person learning,effect person learn
3,contribut,You can contribute more information this way. Oftentimes as a quieter person I find it hard to speak up without being able to make physical cues ie putting hand up etc. This way I can contribute without feeling like I’m saying too much or interrupting other people.,contribut inform way oftentim quieter person find hard speak without abl make physic cue ie put hand etc way contribut without feel like i’m say much interrupt peopl
3,replic,"It replicates physical classes most closely, and you feel more connected with the others in your group and what you are learning.",replic physic class close feel connect other group learn
3,zoomliv,"Zoom/live meetings are very tiring and you have to fully concentrate for the whole duration, whilst recorded lectures you can pause and go at your own speed",zoomliv meet tire fulli concentr whole durat whilst record lectur paus go speed
3,classroom,It’s the closest to a classroom setting,it’ closest classroom set
3,concern,They’re interactive and easy to ask questions or raise concerns within. I think they mimic the classroom atmosphere the best too.,they’r interact easi ask question rais concern within think mimic classroom atmospher best
3,self,Keeps me having a schedule and not having to rely on my self motivation to find time to take the class.,keep schedul reli self motiv find time take class
3,illustr,I study illustration as my core subject - therefore explaining and discussing my work verbally is very important.,studi illustr core subject therefor explain discuss work verbal import
3,immedi,Immediate feedback,immedi feedback
3,along,Recorded videos along uploaded materials ,record video along upload materi
3,hectic,"I think it's easier to communicate with fellow peers, lecturers and other university lecturers. Zoom can be too hectic sometimes and it's hard to get your point across. So doing it through a chat, you can receive a better response. ",think easier commun fellow peer lectur univers lectur zoom hectic sometim hard get point across chat receiv better respons
3,import,Sometimes miss important live information. ,sometim miss import live inform
3,indepth,"Because they are more in-depth, clearly having more time spent on them (all are pre-recorded from last year). In live chats there can be buffering/no audio/audio from students watching programs.",indepth clearli time spent prerecord last year live chat bufferingno audioaudio student watch program
3,strong,"It doesnt rely on a strong internet connection on both ends, no interruptions & can be used to revisit a topic",doesnt reli strong internet connect end interrupt use revisit topic
3,error,More convenient and open to less technology errors etc,conveni open less technolog error etc
3,show,It forces you to show up and not procrastinate ,forc show procrastin
3,person,More personal ,person
3,within,Learning can actually take place within a class environment ,learn actual take place within class environ
3,seminarsclass,"It allows us to work in our own time frame, but I think this form works best in conjunction with recorded lectures or zoom lectures and seminars/classes. ",allow us work time frame think form work best conjunct record lectur zoom lectur seminarsclass
3,recheck,Because I can always recheck the lecture and rewatch what I don’t understand ,alway recheck lectur rewatch don’t understand
3,effect,More personal and effective especially if you have questions ,person effect especi question
3,collabor,"Provides more structure to studying, and has the possibility for group discussion and collaboration ",provid structur studi possibl group discuss collabor
3,control,I’m in more control of when I do it ,i’m control
3,motiv,More motivation ,motiv
3,classmat,Forces you to do the work and get to see classmates ,forc work get see classmat
3,twoway,I prefer to have live interactions with lecturers and other students. pre recorded lectures restrict the two-way teaching that live lectures offer. ,prefer live interact lectur student pre record lectur restrict twoway teach live lectur offer
3,lecturesseminar,I find it harder to motivate myself to join a live class than just watching recordings or discussion forums - it just makes me more anxious but i didn’t have that problem when actually going to lectures/seminars ,find harder motiv join live class watch record discuss forum make anxiou didn’t problem actual go lecturesseminar
3,immers,"Easier to share ideas with other students and immerse yourself in the subject. It can be difficult to focus entirely on a task when you are just reading or listening to a lecture, but being asked to engage with other students and contribute to a group discussion really aids active learning. ",easier share idea student immers subject difficult focu entir task read listen lectur ask engag student contribut group discuss realli aid activ learn
3,replic,"Opportunity for live discussion, replication of seminar environment",opportun live discuss replic seminar environ
3,sort,Creates a sort of routine,creat sort routin
3,ll,Ensures you actually do the lecture rather than thinking “it’ll be there anyways so I’ll do it in my own time”,ensur actual lectur rather think “it’ll anyway i’ll time”
3,materi,"You can always refer back to the material, you aren’t under pressure to write everything down as the lecturer in saying it and can instead focus on the material. I also find that I can cover lecture material quicker independently compared to if classes were live where you can’t skip certain elements which you understand/find easier.",alway refer back materi aren’t pressur write everyth lectur say instead focu materi also find cover lectur materi quicker independ compar class live can’t skip certain element understandfind easier
3,versu,"The recordings can be accessed multiple times, paused, and slowed if needed. They also have much fewer disruptions versus love lectures as are not affected by poor connection etc. ",record access multipl time paus slow need also much fewer disrupt versu love lectur affect poor connect etc
3,detail,Still receiving the same amount of detail (if not more) as we would in normal face-to-face lectures & can also pause and play to make more detailed notes/get a better understanding of the topic ,still receiv amount detail would normal facetofac lectur also paus play make detail notesget better understand topic
3,bave,So i don’t bave to be on camera,don’t bave camera
3,havent,"It forces me to do it! The virus and the situation has really demotivated me with my learning and all my lectures are recorded and uploaded, and as we haven't been having seminars to discuss the topics, I just haven't done any work!!",forc viru situat realli demotiv learn lectur record upload havent seminar discuss topic havent done work
3,closer,closer to normal teaching,closer normal teach
3,forev,"I would actually engage with the class if it was live, but it takes me forever to watch a recorded lecture. ",would actual engag class live take forev watch record lectur
3,structur,Gives me more structure to my day,give structur day
3,total,"there’s no distraction of other students, plus my lecturers have been pretty great in their online vids and I feel totally comfortable to email them questions if i have any!",there’ distract student plu lectur pretti great onlin vid feel total comfort email question
3,practic,It’s more interactive and fun. I’m doing veterinary so it’s nice that during the practical time we can still watch people demonstrating the practicals live where we can instruct them what to do!,it’ interact fun i’m veterinari it’ nice practic time still watch peopl demonstr practic live instruct
3,wind,Can re wind and rewatch,wind rewatch
3,simmilar,"Our university used a combination of live sessions (which I couldn't attend because I was ill), recorded lessons and uploaded/emailed resources. Recorded lectures have a simmilar feeling to live classes, as the professor is able to explain the material at far more depth than just through PowerPoints/word documents, but I could still ask questions via email/forum on brights pace. ",univers use combin live session couldnt attend ill record lesson uploadedemail resourc record lectur simmilar feel live class professor abl explain materi far depth powerpointsword document could still ask question via emailforum bright pace
3,nonverb,I’m an aural learner and really rely on the non-verbal cues of a live session to be able to fully understand a concept. I also only remember things after I’ve discussed them and a recording completely takes that away,i’m aural learner realli reli nonverb cue live session abl fulli understand concept also rememb thing i’v discuss record complet take away
3,anywhereanytim,Easy to access and can be done anywhere/anytime ,easi access done anywhereanytim
3,theatr,Because it gives us a space to work on problems in breakout groups which isn't always possible in a large lecture theatre,give us space work problem breakout group isnt alway possibl larg lectur theatr
3,oblig,The obligation to attend ,oblig attend
