cluster,key word,response,processed response
3,emerg,Because you can watch it when it’s more convenient for you. Sometimes during live lectures you can have emergencies or technical problems which can cause you not to be able to attend.,watch it’ conveni sometim live lectur emerg technic problem caus abl attend
3,anxiou,"I get anxious if I have to interact live with others on zoom, or in a discussion. Plus it is convenient since I work during the day, and can access it whenever. ",get anxiou interact live other zoom discuss plu conveni sinc work day access whenev
3,35,I can do my class at whatever time I want and I can break it up into more manageable chunks as our summer courses are accelerated so a class is 3.5 hours. Breaking it up is way easier than sitting in live class for 3.5 straight hours twice a week for each class,class whatev time want break manag chunk summer cours acceler class 35 hour break way easier sit live class 35 straight hour twice week class
3,peopl,"I believe speaking in front of 50+ people is a barrier to participation, even online. Discussion boards imo allow for more nuanced and constructive discussion (and by extension, learning) as people have the opportunity to reflect and retype before they press submit.",believ speak front 50 peopl barrier particip even onlin discuss board imo allow nuanc construct discuss extens learn peopl opportun reflect retyp press submit
3,zone,"You get to follow the classes at your own pace, and it’s very useful for students in a different time zone like me!",get follow class pace it’ use student differ time zone like
3,live,I live in a different time zone so this is more convenient for me than live classes although I prefer live in principle ,live differ time zone conveni live class although prefer live principl
3,focus,Easier to stay focused,easier stay focus
3,independ,I can read the material independently.,read materi independ
3,directli,It’s easier to communicate directly with the teacher,it’ easier commun directli teacher
3,inclass,"Gives students the ability to learn material on their own time and revisit an entire concept without having to be in person. Also, replicates an in-class experience instead of simply uploading notes (auditory element of a lecture)",give student abil learn materi time revisit entir concept without person also replic inclass experi instead simpli upload note auditori element lectur
3,andgiv,it is most like a classroom setting andgives me a better sense of accountability,like classroom set andgiv better sens account
3,etc,"Forces me to actually watch the lecture, gives structure, etc",forc actual watch lectur give structur etc
3,meet,it's a schedule meeting and you HAVE to do it,schedul meet
3,connect,"-the most engaging form of online learning (from my perspective of course)\n-Helps me feel connected with my instructors and classmates which in turn makes me connect more to the material and encouraging through sense of community\n-ability to ask questions as I learn new material, and creates discussions within “classroom” that leads to more critical thinking \n-from my experience it is more detailed, and concepts stick most easily ",engag form onlin learn perspect coursenhelp feel connect instructor classmat turn make connect materi encourag sens communityn ask question learn new materi creat discuss within “classroom” lead critic think nfrom experi detail concept stick easili
3,job,"My part time job as a university student suddenly became a full time job because of the coronavirus (I work in a clinic) . Having pre-recorded lectures or uploaded content allowed me to actually finish my semester (as I would not have been able to attend live classes). Although It might not be an ideal method for learning effectively, it allowed me to not miss out on anything. Discussion formus were also opened to discuss the material afterwards. ",part time job univers student suddenli becam full time job coronaviru work clinic prerecord lectur upload content allow actual finish semest would abl attend live class although might ideal method learn effect allow miss anyth discuss formu also open discuss materi afterward
3,tradit,because you can still have traditional lectures and seminars ,still tradit lectur seminar
3,situación,"In the current situación internet is not working so well, so a recorded class is easy to understand, and you can ask later to the professor ",current situación internet work well record class easi understand ask later professor
3,right,It’s the closest thing right know to have a connection with my teachers,it’ closest thing right know connect teacher
3,tend,It's often more concise and i can rewatch the videos if i need to review a certain topic also my professors tend to rumble a lot which sometimes makes watching their online classes difficult especially if u tend to get distracted very easily which is my case having adhd.,often concis rewatch video need review certain topic also professor tend rumbl lot sometim make watch onlin class difficult especi u tend get distract easili case adhd
3,model,"Because i’m concentrate easily with that model, while i got live classes. i’m get lose more fast with question of another people",i’m concentr easili model got live class i’m get lose fast question anoth peopl
3,late,"since the teachers go too fast online (because you have some delay, so questions get either late or you forget about your question) I prefer to watch the video at my own speed.",sinc teacher go fast onlin delay question get either late forget question prefer watch video speed
3,immed,"The teachers can answer our questions immedately and everything have better explanations, but i have a lot classmates with internet issues so it doesn't work well for them.",teacher answer question immed everyth better explan lot classmat internet issu doesnt work well
3,regular,It resembles our regular classes the most,resembl regular class
3,creat,Creates a sense of being in an actual class,creat sens actual class
3,great,Actually my classes are live but it's recorded so we can watch the lectures again and it's great because I can rewatch the part that I don't understand.,actual class live record watch lectur great rewatch part dont understand
3,share,"it gives a sense that I'm sharing the lecture time with real people (lecturers and classmates), not just a video",give sens im share lectur time real peopl lectur classmat video
3,love,Because I don't learn much by listening and I love my freedom and organization when it comes to studying. ,dont learn much listen love freedom organ come studi
3,senc,A bigger sence of comunity,bigger senc comun
3,dont,Beacuse I actually listen to my professor and I can ask questions if I don't understand something. Also I hate recored lessons because I procrastinate on them and I don't listen to them regularly. ,beacus actual listen professor ask question dont understand someth also hate recor lesson procrastin dont listen regularli
3,teacher,"I study maths, so I like to be able to pause the video and think about the complicated concepts the teacher is talking about. And I can email my teacher later about the questions.",studi math like abl paus video think complic concept teacher talk email teacher later question
3,closest,Because it’s the closest thing to the real class.,it’ closest thing real class
3,gap,It requires students to study and understand the material beforehand then coming to the discussion and have the professor and other classmates fill the gaps in the knowledge.  ,requir student studi understand materi beforehand come discuss professor classmat fill gap knowledg
3,way,It's the only way.,way
3,revis,Because it makes me study when it's live. I actually prefer live classes that are recorded for later revision ,make studi live actual prefer live class record later revis
3,argument,"Would motivate us to read it at first and then apply the knowledge and discuss arguments. Moreover, students might be less afraid to ask questions for clarification of what they do not understand.",would motiv us read first appli knowledg discuss argument moreov student might less afraid ask question clarif understand
3,cours,"The range of my courses is really wide, so for sciences like Mathematics and Physics I actually prefer Recorded lectures, but for courses like English or Art history I actually prefer Live classes. ",rang cours realli wide scienc like mathemat physic actual prefer record lectur cours like english art histori actual prefer live class
3,tell,I just like it better - teacher can tell us what he didn't write in the presentation.,like better teacher tell us didnt write present
3,introvert,I am an introvert so i videos are better than zoom.,introvert video better zoom
3,exploit,Recorded lectures allow me to manage my time better than attending live classes. I also exploit the possibility to speed it up or rewind the parts that I don’t understand clearly.\nIdeally combined with discussion forums to make up for the lost interactivity,record lectur allow manag time better attend live class also exploit possibl speed rewind part don’t understand clearlynid combin discuss forum make lost interact
3,forgot,I can watch it again when i forgot something,watch forgot someth
3,right,"It's more practical, you can also right away ask your instructor about anything you don't understand.",practic also right away ask instructor anyth dont understand
3,zoomlectur,"It is the most “normal” kind of teaching, compared to how it was before. Lectures generally works really well for me, and the limited amount of student participation makes it easily transferable into a zoom-lecture",“normal” kind teach compar lectur gener work realli well limit amount student particip make easili transfer zoomlectur
3,particip,"It is comfortable to be able to take the lecture at any time, also don’t feel the pressure to participate. Also if some of the content is too easy can easily skip forward, or if something is unclear go listen to it again. (I know that participating would be good, but perks of remote school have that it’s  not forced)",comfort abl take lectur time also don’t feel pressur particip also content easi easili skip forward someth unclear go listen know particip would good perk remot school it’ forc
3,choos,"I can choose when to pause the video and take a break. That option is not possible when the class is on Zoom or the like. Online teaching lacks the social aspect of catching communication signs in eyes and body language, which in turn tires out the brain faster. If the lectures were prerecorded with uploaded materials, the students could choose to join study groups and discuss the materials afterwards, at their own pace. ",choos paus video take break option possibl class zoom like onlin teach lack social aspect catch commun sign eye bodi languag turn tire brain faster lectur prerecord upload materi student could choos join studi group discuss materi afterward pace
3,solv,"It’s the most similar to real life teaching, questions can be solved at the moment ",it’ similar real life teach question solv moment
3,discussionquest,"My uni did recorded lectures with discussion on zoom afterwards which was actually great! It had the classroom benefits of discussion/questions etc but now that I am taking my exams, I am loving being able to revisit the old lectures!",uni record lectur discuss zoom afterward actual great classroom benefit discussionquest etc take exam love abl revisit old lectur
3,come,It comes closest to the normal way of having class,come closest normal way class
3,make,"Cause, lives classes help you to make a connection with the education you get through your teacher and your classmates . And also makes everything easier because you feel motivated ",caus live class help make connect educ get teacher classmat also make everyth easier feel motiv
3,model,Because it is the most similar model to an actual class,similar model actual class
3,extent,Because it depends on the live interaction and if i couldn't understand something the lecturer could repeat it again in another way and it mimics the actual real courses to some extent ,depend live interact couldnt understand someth lectur could repeat anoth way mimic actual real cours extent
3,span,I can hear/ watch the recorded lecture anytime and rewind the bits I've missed because my attention spans is short,hear watch record lectur anytim rewind bit ive miss attent span short
3,track,makes me that we are on track and and that everyone is following up,make track everyon follow
3,unstablen,As the lecture is explained well in a vid and i can pause anytime to listen again. The internet can be adjusted unlike the zoom meetings where it could be unstable\n,lectur explain well vid paus anytim listen internet adjust unlik zoom meet could unstablen
3,replic,Because being in a zoom meeting replicates the classroom environment the most,zoom meet replic classroom environ
3,sever,"Because it gives me my space to watch the videos, do my own research about the topic, listen carefully and several times to the records and when I need to ask any questions I can contact my professor anytime.",give space watch video research topic listen care sever time record need ask question contact professor anytim
3,ntho,Because I can replay the parts that i want to have a solid grasp of .\nTho i would say that an add live session would be beneficial so you can ask questions directly,replay part want solid grasp ntho would say add live session would benefici ask question directli
3,yet,Better explanation yet no internet interruption ,better explan yet internet interrupt
3,postpon,Because I think that way will make me postpone watching the lectures less,think way make postpon watch lectur less
3,whi,"Because I am a very interactive person, I learn by engaging with others on different POV and searching for the Why's and How's. It has highest long-term chance of sticking in my memory.",interact person learn engag other differ pov search whi how highest longterm chanc stick memori
3,need,This is the best way to comunicate with my instructor. As we need a back and forth conversation in my fine art course to fully understand what they need us to achieve . ,best way comun instructor need back forth convers fine art cours fulli understand need us achiev
3,docotor,The lectures themselves aren’t really clear if our Docotor isn’t explaining them. ,lectur aren’t realli clear docotor isn’t explain
3,theyll,"Because I can make questions and they'll be answered instantly, and I feel that this way makes more dynamic the learning",make question theyll answer instantli feel way make dynam learn
3,within,We get to have a real-time response and way more feedback is case there's information lost within the communication!,get realtim respons way feedback case there inform lost within commun
3,option,Is the best option. ,best option
3,keep,Helps me keep a normal schedule,help keep normal schedul
3,afterward,Communicating is easier + all the information is easy to find afterwards when it's written down,commun easier inform easi find afterward written
3,theatr,Because I study theatre and the only proper way to have online courses is live classes.,studi theatr proper way onlin cours live class
3,decid,I can decide when I do my assignments and make my own schedule. ,decid assign make schedul
3,studi,I like the freedom of choosing when I want to study. I love to be able to see all that i'm excpected to learn in my course at one glance-> I can plan my studies in advance,like freedom choos want studi love abl see im excpect learn cours one glanc plan studi advanc
3,assing,"I can study at a time I prefer the most. Also when doing homework and assingments, it is easier to find help to those from lecture notes or other uploaded materials rather than from live or video lectures.",studi time prefer also homework assing easier find help lectur note upload materi rather live video lectur
3,speak,It’s easier to follow and understand since the professor is speaking ,it’ easier follow understand sinc professor speak
3,similar,It is the most similar to in person learning,similar person learn
3,read,Because I'm obliged to listen to what the professor at least for a bit whereas I don't read read the documents sent to us by emails,im oblig listen professor least bit wherea dont read read document sent us email
3,school,"I come from a Business School were classes are very much like in secondary school , and not so much like lectures so to me using zoom or other similar platforms was the most similar to ‘real’ classes. ",come busi school class much like secondari school much like lectur use zoom similar platform similar ‘real’ class
3,log,It replicates the environment of a real classroom as much as possible and having set times that I need to log on and learn helps keep structure ,replic environ real classroom much possibl set time need log learn help keep structur
3,oral,It's easier to understand something when someone is actually explaining orally rather than only reading it,easier understand someth someon actual explain oral rather read
3,entir, it’s way easier in order to organise my work through the entire week,it’ way easier order organis work entir week
3,irl,It’s the less different from IRL classes,it’ less differ irl class
3,replay,It allows to learn at our own speed (replay the video),allow learn speed replay video
3,ie,"when i'm home, i like to work when i want to (ie preferably not at 8 am) and most of our class times never fit in the timetable i made for myself ",im home like work want ie prefer 8 class time never fit timet made
3,fall,"Having live classes forces you to be ahead of your work, or at least not to fall behind ",live class forc ahead work least fall behind
3,ii,Ii is more convenient and I can finally follow my own timetable. ,ii conveni final follow timet
3,kind,"Because it helps to keep the same kind of dynamic as actual classes, plus you can talk directly to the teacher ",help keep kind dynam actual class plu talk directli teacher
3,poor,Due to my poor internet connection it was the best option I had to keep up on my uni classes. ,due poor internet connect best option keep uni class
3,contain,Because it contains more information and it is easier to read at anytime ,contain inform easier read anytim
3,front,I actually get live explanations on the lesson and in general I am more focused in lectures than alone in front of course material. ,actual get live explan lesson gener focus lectur alon front cours materi
3,focu,"You can actually see the professor and the students, it helps me to focus ",actual see professor student help focu
3,interactiv,It's more interactiv ,interactiv
3,NA,I ,
3,record,Recorded videos and recordings for sure ,record video record sure
3,overal,"More interaction, although I also like recorded lectures. Overall, seeing the professors and hearing them explain the content is a lot better for understanding than simply reading the material.",interact although also like record lectur overal see professor hear explain content lot better understand simpli read materi
3,aliv,Do it at your own rhythm but also more alive than just reading pdf or text,rhythm also aliv read pdf text
3,prepar,It forces me to be focused and prepare for the class,forc focus prepar class
3,focu,Best to focus,best focu
3,cours,It helps me understand the course better,help understand cours better
3,classesdiscuss,Because bad internet connections make live classes/discussion forums impossible,bad internet connect make live classesdiscuss forum imposs
3,im,I'm more focus during live class,im focu live class
3,availabilit,Makes it easier to study at your pace and according to your availabilites.,make easier studi pace accord availabilit
3,physic,"To me, it's the one that looks the most to real classes I used to have before our university closed (physically)",one look real class use univers close physic
3,uploadedemail,Because it’s really similar to actually attending class and I tend to find it more appealing than studying uploaded/emailed materials on my own.,it’ realli similar actual attend class tend find appeal studi uploadedemail materi
3,cours,Because it allow me to follow the course whenever I want and because I prefer listening to teachers instead of reading a entire course by myself for the first time. (I also like ondine live classes a lot),allow follow cours whenev want prefer listen teacher instead read entir cours first time also like ondin live class lot
3,organis,I like when instructors trusted us and simply send their courses by email (or put them on a sharing platform). It's way less difficult and exhausting than when they organised lived classes or discussions forums  (where it's often badly organised + internet access problem for some...),like instructor trust us simpli send cours email put share platform way less difficult exhaust organis live class discuss forum often badli organis internet access problem
3,thank,"We can make sure we understood the material and receive a more detailed explanation of the material we are studying. Moreover, we can benefit from the questions and answers of our peers and expand our reasoning thanks to them. ",make sure understood materi receiv detail explan materi studi moreov benefit question answer peer expand reason thank
3,written,"in most of subjects, I can learn better when the course is written",subject learn better cours written
3,much,Because I find it much easier to take notes. It’s not really the best as much as it is the less bad. It also is better for me as a disabled student. ,find much easier take note it’ realli best much less bad also better disabl student
3,angag,Students are more angaged and interested,student angag interest
3,trough,"While recorded lectures are more comfortable to watch, it's easier to communicate trough live classes - you can participate, ask questions etc. Also, you have a sense of routine (you have a lecture at a specific time).",record lectur comfort watch easier commun trough live class particip ask question etc also sens routin lectur specif time
3,dail,"I can interact with it at my own pace so it makes it easier to integrate studying into my dail life, it doesn't drain my energy as much as zoom classes do but it still feels more personal than just being provided with materials and having no human connection.",interact pace make easier integr studi dail life doesnt drain energi much zoom class still feel person provid materi human connect
3,tend,When Classes are pre recorded I tend to procrastinate more ,class pre record tend procrastin
3,tend,When Classes are pre recorded I tend to procrastinate more ,class pre record tend procrastin
3,record,Recorded ,record
3,contribut,Contribute and have direct feedback,contribut direct feedback
3,particip,Active learning/ participation ,activ learn particip
3,stress,I like completing the materials at my own speed and I find live classes very stressful.,like complet materi speed find live class stress
3,unfamiliar,It's easy to discuss more complex and unfamiliar topics and get answers from the instructor right away if you don't understand something. ,easi discuss complex unfamiliar topic get answer instructor right away dont understand someth
3,repeat,I can study it at my speed and repeat certain parts ,studi speed repeat certain part
3,doesn,It’s easier to concentrate than live classes and I can do it on my own schedule. It doesn’t require a good internet connection. ,it’ easier concentr live class schedul doesn’t requir good internet connect
3,cours,Because you can re watch the course. ,watch cours
3,closest,Its the closest we can get to actual discussions in person,closest get actual discuss person
3,flexibl,Flexibility ,flexibl
3,uni,Because it has the mix between a lecture like it is at uni and the interaction with questions... it doesn't differ that much from what I am used to at uni,mix lectur like uni interact question doesnt differ much use uni
3,flexibl,Flexibility,flexibl
3,pay,Forces you to pay attention and have routine,forc pay attent routin
3,definit,For me personally it is the most effective working mode because it definitely provides more freedom as you get to schedule your day/ week on your own terms instead of having to stick to fixed times and dates (as it's the case for live classes etc) ,person effect work mode definit provid freedom get schedul day week term instead stick fix time date case live class etc
3,passag,You can repeat passages or rewatch the whole lecture,repeat passag rewatch whole lectur
3,taught,It is more similar to the usual way courses are taught at my university.,similar usual way cours taught univers
3,output,"Because even though communication is limited, it's better to have an output possibility as opposed to just input through e.g. recorded lectures.",even though commun limit better output possibl oppos input eg record lectur
3,schedul,I can do it on my own schedule ,schedul
3,subject,Because I get to know ideas other than my own on a subject,get know idea subject
3,statist,It depends on the course. Some are teached better through Zoom. But for others like statistic recorded lectures work better.,depend cours teach better zoom other like statist record lectur work better
